{
  "version": 2,
  "status": "PROPOSED_NOT_RUNTIME",
  "authority": {
    "tier0": "KnowMe calculation engine",
    "tier1": "หลักมหาภูต ฉบับสมบูรณ์ — ส. หยกฟ้า",
    "extractionEditionId": "mahabhut-complete-duangkaew-2537-scan",
    "authorityEditionId": "mahabhut-complete-printing3-2539",
    "editionMappingStatus": "PENDING"
  },
  "rules": [
    {
      "ruleId": "MPR2-RISE-POSITION",
      "bookId": "mahabhut",
      "editionId": "mahabhut-complete-duangkaew-2537-scan",
      "sourcePage": "17",
      "sourceSection": "ความรู้เรื่องดวงขึ้นและดวงตก",
      "sourceScope": "GENERAL",
      "sourceStatementType": "GENERAL_RULE",
      "applicability": ["period planet and Mahabhut position are both proven"],
      "allOfConditions": ["life period is active", "period planet occupies thongchai, khumsap, racha or athibodi"],
      "anyOfConditions": [],
      "excludedConditions": [],
      "planet": null,
      "mahabhutPosition": "thongchai|khumsap|racha|athibodi",
      "taksaRole": null,
      "periodStatus": "dueng_khuen",
      "lifePeriodContext": "active period",
      "archetypeContext": null,
      "ageBoundary": null,
      "domain": "life_period_transition",
      "eventFamily": "life_period_transition",
      "movement": "classify period as rising",
      "predictedOutcome": "The active period may be described as ดวงขึ้น for its full source-defined duration.",
      "polarity": "POSITIVE",
      "sourceCertainty": "DIRECT",
      "timingGranularity": "PERIOD",
      "exceptions": ["Kalakini exception is governed by MPR2-KALAKINI-STRONG-EXCEPTION"],
      "conflictGroup": null,
      "provenance": {
        "evidenceExcerpt": "สถิตเสถียรอยู่เรือนธงชัย-ขุมทรัพย์-ราชา-อธิบดี",
        "pageImageReviewed": true,
        "ocrCrossChecked": true,
        "pdfSha256": "28D74F5D7258A00EFA4967186B15ED97174E173AB12BD4DF9FBED66BD3EA890E"
      },
      "extractionStatus": "EXTRACTED",
      "reviewerStatus": "OWNER_REVIEW_REQUIRED",
      "allowedConclusion": "Classify a proven period as rising; state no specific external event unless another rule supplies it.",
      "prohibitedEscalation": ["specific actor", "amount", "event count", "exact event date", "guaranteed success"],
      "generalization": "GENERALIZABLE_AS_WRITTEN",
      "knownTimeRequirement": "KNOWN_THAI_DAY_REQUIRED",
      "humanExplanation": "The source defines period status from the period planet's Mahabhut house, not from a score threshold."
    },
    {
      "ruleId": "MPR2-FALL-POSITION",
      "bookId": "mahabhut",
      "editionId": "mahabhut-complete-duangkaew-2537-scan",
      "sourcePage": "17",
      "sourceSection": "ความรู้เรื่องดวงขึ้นและดวงตก",
      "sourceScope": "GENERAL",
      "sourceStatementType": "GENERAL_RULE",
      "applicability": ["period planet and Mahabhut position are both proven"],
      "allOfConditions": ["life period is active", "period planet occupies phangkha, marana or puti"],
      "anyOfConditions": [],
      "excludedConditions": [],
      "planet": null,
      "mahabhutPosition": "phangkha|marana|puti",
      "taksaRole": null,
      "periodStatus": "dueng_tok",
      "lifePeriodContext": "active period",
      "archetypeContext": null,
      "ageBoundary": null,
      "domain": "life_period_transition",
      "eventFamily": "life_period_transition",
      "movement": "classify period as falling",
      "predictedOutcome": "The active period may be described as ดวงตก for its full source-defined duration.",
      "polarity": "NEGATIVE",
      "sourceCertainty": "DIRECT",
      "timingGranularity": "PERIOD",
      "exceptions": ["Kalakini exception is governed by MPR2-KALAKINI-WEAK-EXCEPTION"],
      "conflictGroup": null,
      "provenance": {
        "evidenceExcerpt": "สถิตเสถียรอยู่เรือนภังคะ มรณะ และปูติ",
        "pageImageReviewed": true,
        "ocrCrossChecked": true,
        "pdfSha256": "28D74F5D7258A00EFA4967186B15ED97174E173AB12BD4DF9FBED66BD3EA890E"
      },
      "extractionStatus": "EXTRACTED",
      "reviewerStatus": "OWNER_REVIEW_REQUIRED",
      "allowedConclusion": "Classify a proven period as falling and preserve source uncertainty; do not name an event without a separate rule.",
      "prohibitedEscalation": ["death claim", "medical diagnosis", "specific loss", "amount", "exact event date"],
      "generalization": "GENERALIZABLE_AS_WRITTEN",
      "knownTimeRequirement": "KNOWN_THAI_DAY_REQUIRED",
      "humanExplanation": "The negative status follows the stated house set and does not authorize a particular adverse event."
    },
    {
      "ruleId": "MPR2-FALL-BOUNDARY-INTENSITY",
      "bookId": "mahabhut",
      "editionId": "mahabhut-complete-duangkaew-2537-scan",
      "sourcePage": "17",
      "sourceSection": "ความรู้เรื่องดวงขึ้นและดวงตก",
      "sourceScope": "LIFE_PERIOD",
      "sourceStatementType": "CONDITIONAL_RULE",
      "applicability": ["MPR2-FALL-POSITION applies", "exact period boundary is proven"],
      "allOfConditions": ["period status is dueng_tok", "age is at start, end or one-to-two years before end"],
      "anyOfConditions": [],
      "excludedConditions": [],
      "planet": null,
      "mahabhutPosition": "phangkha|marana|puti",
      "taksaRole": null,
      "periodStatus": "dueng_tok",
      "lifePeriodContext": "period boundary",
      "archetypeContext": null,
      "ageBoundary": "start, end, or 1-2 years before end",
      "domain": "risk_pressure",
      "eventFamily": "expense_or_obligation",
      "movement": "increase fall-risk intensity at source-defined boundary",
      "predictedOutcome": "The source marks these boundary years as a stronger falling phase, without identifying a guaranteed event.",
      "polarity": "NEGATIVE",
      "sourceCertainty": "DIRECT",
      "timingGranularity": "BOUNDARY_WINDOW",
      "exceptions": [],
      "conflictGroup": null,
      "provenance": {
        "evidenceExcerpt": "เริ่มเสวยอายุและจะสิ้นสุดการเสวยอายุ",
        "pageImageReviewed": true,
        "ocrCrossChecked": true,
        "pdfSha256": "28D74F5D7258A00EFA4967186B15ED97174E173AB12BD4DF9FBED66BD3EA890E"
      },
      "extractionStatus": "EXTRACTED",
      "reviewerStatus": "OWNER_REVIEW_REQUIRED",
      "allowedConclusion": "State only that source-defined fall pressure is stronger in the stated boundary window.",
      "prohibitedEscalation": ["guaranteed loss", "death", "illness", "amount", "month", "specific event"],
      "generalization": "GENERALIZABLE_AS_WRITTEN",
      "knownTimeRequirement": "KNOWN_THAI_DAY_REQUIRED",
      "humanExplanation": "This is a real source window, not an equal split of a rolling year."
    },
    {
      "ruleId": "MPR2-WEAK-HOUSE-EFFECT",
      "bookId": "mahabhut",
      "editionId": "mahabhut-complete-duangkaew-2537-scan",
      "sourcePage": "40",
      "sourceSection": "หลักการทำนาย",
      "sourceScope": "GENERAL",
      "sourceStatementType": "CONDITIONAL_RULE",
      "applicability": ["planet or Taksa role and its represented domain are proven"],
      "allOfConditions": ["planet or Taksa role occupies phangkha, marana or puti", "role is not Kalakini"],
      "anyOfConditions": [],
      "excludedConditions": ["Kalakini"],
      "planet": null,
      "mahabhutPosition": "phangkha|marana|puti",
      "taksaRole": null,
      "periodStatus": null,
      "lifePeriodContext": null,
      "archetypeContext": null,
      "ageBoundary": null,
      "domain": "role_domain_strength",
      "eventFamily": null,
      "movement": "reduce strength and reliability in the represented domain",
      "predictedOutcome": "The represented person or matter is weaker, slower or less dependable; this is not a specific event movement.",
      "polarity": "NEGATIVE",
      "sourceCertainty": "DIRECT",
      "timingGranularity": "NONE",
      "exceptions": ["MPR2-KALAKINI-WEAK-EXCEPTION"],
      "conflictGroup": null,
      "provenance": {
        "evidenceExcerpt": "มีกำลังอ่อน มีแสงสว่างน้อย มัวหมองมาก",
        "pageImageReviewed": true,
        "ocrCrossChecked": true,
        "pdfSha256": "28D74F5D7258A00EFA4967186B15ED97174E173AB12BD4DF9FBED66BD3EA890E"
      },
      "extractionStatus": "EXTRACTED",
      "reviewerStatus": "OWNER_REVIEW_REQUIRED",
      "allowedConclusion": "Describe lower source-defined strength or reliability in the proven represented domain.",
      "prohibitedEscalation": ["domain-specific event without a rule", "actor identity", "count", "amount", "date"],
      "generalization": "GENERALIZABLE_AS_WRITTEN",
      "knownTimeRequirement": "KNOWN_THAI_DAY_REQUIRED",
      "humanExplanation": "The source supports a quality/strength statement, not automatic income loss, illness or relationship ending."
    },
    {
      "ruleId": "MPR2-KALAKINI-WEAK-EXCEPTION",
      "bookId": "mahabhut",
      "editionId": "mahabhut-complete-duangkaew-2537-scan",
      "sourcePage": "40",
      "sourceSection": "หลักการทำนาย — ข้อยกเว้นกาฬกิณี",
      "sourceScope": "GENERAL",
      "sourceStatementType": "EXCEPTION_RULE",
      "applicability": ["Taksa role is proven as Kalakini"],
      "allOfConditions": ["Kalakini occupies phangkha, marana or puti"],
      "anyOfConditions": [],
      "excludedConditions": [],
      "planet": null,
      "mahabhutPosition": "phangkha|marana|puti",
      "taksaRole": "kalakini",
      "periodStatus": null,
      "lifePeriodContext": null,
      "archetypeContext": null,
      "ageBoundary": null,
      "domain": "obstacle_pressure",
      "eventFamily": null,
      "movement": "weaken Kalakini obstruction",
      "predictedOutcome": "The source treats weakened Kalakini in these houses as reduced obstacle pressure.",
      "polarity": "POSITIVE",
      "sourceCertainty": "DIRECT",
      "timingGranularity": "NONE",
      "exceptions": [],
      "conflictGroup": "kalakini-house-polarity",
      "provenance": {
        "evidenceExcerpt": "อำนาจความชั่วร้ายของกาฬกิณีอ่อนแอ",
        "pageImageReviewed": true,
        "ocrCrossChecked": true,